{
  "implementation": {
    "name": "universal-manifest-reference",
    "version": "0.1.0",
    "language": "typescript",
    "organization": "universalmanifest",
    "repository": "https://github.com/grigb/universal-manifest"
  },
  "specVersionsTested": [
    "0.1",
    "0.2"
  ],
  "testDate": "2026-03-02T22:20:37.628Z",
  "suiteVersion": "0.1.0",
  "results": {
    "v0.1": {
      "total": 32,
      "passed": 32,
      "failed": 0,
      "skipped": 0,
      "details": [
        {
          "fixture": "invalid/empty-id.jsonld",
          "expectedResult": "reject",
          "actualResult": "reject",
          "pass": true,
          "reason": "Reject fixture: Missing @id.",
          "adapterReason": "Missing @id",
          "category": "required-fields",
          "specVersion": "0.1",
          "conformanceLevel": "baseline"
        },
        {
          "fixture": "invalid/expired-for-use.jsonld",
          "expectedResult": "reject",
          "actualResult": "reject",
          "pass": true,
          "reason": "Reject fixture: Manifest expired.",
          "adapterReason": "Manifest expired",
          "category": "ttl",
          "specVersion": "0.1",
          "conformanceLevel": "baseline"
        },
        {
          "fixture": "invalid/invalid-expiresAt-format.jsonld",
          "expectedResult": "reject",
          "actualResult": "reject",
          "pass": true,
          "reason": "Reject fixture: expiresAt must be an ISO date-time.",
          "adapterReason": "expiresAt must be an ISO date-time",
          "category": "ttl",
          "specVersion": "0.1",
          "conformanceLevel": "baseline"
        },
        {
          "fixture": "invalid/invalid-issuedAt-format.jsonld",
          "expectedResult": "reject",
          "actualResult": "reject",
          "pass": true,
          "reason": "Reject fixture: issuedAt must be an ISO date-time.",
          "adapterReason": "issuedAt must be an ISO date-time",
          "category": "ttl",
          "specVersion": "0.1",
          "conformanceLevel": "baseline"
        },
        {
          "fixture": "invalid/issued-after-expires.jsonld",
          "expectedResult": "reject",
          "actualResult": "reject",
          "pass": true,
          "reason": "Reject fixture: issuedAt must be <= expiresAt.",
          "adapterReason": "issuedAt must be <= expiresAt",
          "category": "ttl",
          "specVersion": "0.1",
          "conformanceLevel": "baseline"
        },
        {
          "fixture": "invalid/missing-context.jsonld",
          "expectedResult": "reject",
          "actualResult": "reject",
          "pass": true,
          "reason": "Reject fixture: Missing @context.",
          "adapterReason": "Missing @context",
          "category": "required-fields",
          "specVersion": "0.1",
          "conformanceLevel": "baseline"
        },
        {
          "fixture": "invalid/missing-id.jsonld",
          "expectedResult": "reject",
          "actualResult": "reject",
          "pass": true,
          "reason": "Reject fixture: Missing @id.",
          "adapterReason": "Missing @id",
          "category": "required-fields",
          "specVersion": "0.1",
          "conformanceLevel": "baseline"
        },
        {
          "fixture": "invalid/missing-subject.jsonld",
          "expectedResult": "reject",
          "actualResult": "reject",
          "pass": true,
          "reason": "Reject fixture: Missing subject.",
          "adapterReason": "Missing subject",
          "category": "required-fields",
          "specVersion": "0.1",
          "conformanceLevel": "baseline"
        },
        {
          "fixture": "invalid/shard-wrong-type.jsonld",
          "expectedResult": "reject",
          "actualResult": "reject",
          "pass": true,
          "reason": "Reject fixture: Missing um:Shard in shard @type.",
          "adapterReason": "Missing um:Shard in shard @type",
          "category": "type-shape",
          "specVersion": "0.1",
          "conformanceLevel": "baseline"
        },
        {
          "fixture": "invalid/shards-not-array.jsonld",
          "expectedResult": "reject",
          "actualResult": "reject",
          "pass": true,
          "reason": "Reject fixture: shards must be an array.",
          "adapterReason": "shards must be an array",
          "category": "shards",
          "specVersion": "0.1",
          "conformanceLevel": "baseline"
        },
        {
          "fixture": "invalid/wrong-type.jsonld",
          "expectedResult": "reject",
          "actualResult": "reject",
          "pass": true,
          "reason": "Reject fixture: Missing um:Manifest in @type.",
          "adapterReason": "Missing um:Manifest in @type",
          "category": "type-shape",
          "specVersion": "0.1",
          "conformanceLevel": "baseline"
        },
        {
          "fixture": "valid/manifest-with-shards.jsonld",
          "expectedResult": "accept",
          "actualResult": "accept",
          "pass": true,
          "reason": "Valid shard composition fixture with typed shard entries.",
          "adapterReason": "0.1 manifest validated (structural)",
          "category": "shards",
          "specVersion": "0.1",
          "conformanceLevel": "baseline"
        },
        {
          "fixture": "valid/minimal-manifest.jsonld",
          "expectedResult": "accept",
          "actualResult": "accept",
          "pass": true,
          "reason": "Baseline minimal v0.1 manifest with all required fields.",
          "adapterReason": "0.1 manifest validated (structural)",
          "category": "required-fields",
          "specVersion": "0.1",
          "conformanceLevel": "baseline"
        },
        {
          "fixture": "valid/stubs/bluesky-personhood-multi-credential-manifest.jsonld",
          "expectedResult": "accept",
          "actualResult": "accept",
          "pass": true,
          "reason": "Near-real Bluesky Personhood Multi Credential Manifest stub remains structurally valid under v0.1.",
          "adapterReason": "0.1 manifest validated (structural)",
          "category": "integration-stub",
          "specVersion": "0.1",
          "conformanceLevel": "baseline"
        },
        {
          "fixture": "valid/stubs/chia-credential-lane-manifest.jsonld",
          "expectedResult": "accept",
          "actualResult": "accept",
          "pass": true,
          "reason": "Near-real Chia Credential Lane Manifest stub remains structurally valid under v0.1.",
          "adapterReason": "0.1 manifest validated (structural)",
          "category": "integration-stub",
          "specVersion": "0.1",
          "conformanceLevel": "baseline"
        },
        {
          "fixture": "valid/stubs/creator-public-capsule-manifest.jsonld",
          "expectedResult": "accept",
          "actualResult": "accept",
          "pass": true,
          "reason": "Near-real Creator Public Capsule Manifest stub remains structurally valid under v0.1.",
          "adapterReason": "0.1 manifest validated (structural)",
          "category": "integration-stub",
          "specVersion": "0.1",
          "conformanceLevel": "baseline"
        },
        {
          "fixture": "valid/stubs/cross-system-projection-manifest.jsonld",
          "expectedResult": "accept",
          "actualResult": "accept",
          "pass": true,
          "reason": "Near-real Cross System Projection Manifest stub remains structurally valid under v0.1.",
          "adapterReason": "0.1 manifest validated (structural)",
          "category": "integration-stub",
          "specVersion": "0.1",
          "conformanceLevel": "baseline"
        },
        {
          "fixture": "valid/stubs/display-device-manifest.jsonld",
          "expectedResult": "accept",
          "actualResult": "accept",
          "pass": true,
          "reason": "Near-real Display Device Manifest stub remains structurally valid under v0.1.",
          "adapterReason": "0.1 manifest validated (structural)",
          "category": "integration-stub",
          "specVersion": "0.1",
          "conformanceLevel": "baseline"
        },
        {
          "fixture": "valid/stubs/display-envelope-manifest.jsonld",
          "expectedResult": "accept",
          "actualResult": "accept",
          "pass": true,
          "reason": "Near-real Display Envelope Manifest stub remains structurally valid under v0.1.",
          "adapterReason": "0.1 manifest validated (structural)",
          "category": "integration-stub",
          "specVersion": "0.1",
          "conformanceLevel": "baseline"
        },
        {
          "fixture": "valid/stubs/mastodon-personhood-multi-credential-manifest.jsonld",
          "expectedResult": "accept",
          "actualResult": "accept",
          "pass": true,
          "reason": "Near-real Mastodon Personhood Multi Credential Manifest stub remains structurally valid under v0.1.",
          "adapterReason": "0.1 manifest validated (structural)",
          "category": "integration-stub",
          "specVersion": "0.1",
          "conformanceLevel": "baseline"
        },
        {
          "fixture": "valid/stubs/metaverse-crossworld-profile-manifest.jsonld",
          "expectedResult": "accept",
          "actualResult": "accept",
          "pass": true,
          "reason": "Near-real Metaverse Crossworld Profile Manifest stub remains structurally valid under v0.1.",
          "adapterReason": "0.1 manifest validated (structural)",
          "category": "integration-stub",
          "specVersion": "0.1",
          "conformanceLevel": "baseline"
        },
        {
          "fixture": "valid/stubs/multi-did-method-coverage-manifest.jsonld",
          "expectedResult": "accept",
          "actualResult": "accept",
          "pass": true,
          "reason": "Near-real Multi Did Method Coverage Manifest stub remains structurally valid under v0.1.",